{
  "$schema": "http://json-schema.org/draft-07/schema#",
  "$id": "schema/performance.schema.json",
  "title": "Performance quality levels",
  "description": "Shape contract for shared/data/performance.json. Generated by tools/studio/gen-schemas.mjs — edit the generator, not this file.",
  "type": "object",
  "required": [
    "autoDetect",
    "budget",
    "qualityLevels",
    "renderPipeline",
    "version"
  ],
  "additionalProperties": false,
  "properties": {
    "$schema": {
      "type": "string"
    },
    "_comment": {
      "type": "string"
    },
    "autoDetect": {
      "type": "object",
      "properties": {
        "fpsLowToMedium": {
          "type": "integer"
        },
        "fpsMediumToHigh": {
          "type": "integer"
        },
        "hysteresisFps": {
          "type": "integer"
        },
        "overrideKey": {
          "type": "string"
        },
        "ramThresholdMBLow": {
          "type": "integer"
        },
        "sampleSeconds": {
          "type": "integer"
        }
      },
      "required": [
        "fpsLowToMedium",
        "fpsMediumToHigh",
        "hysteresisFps",
        "overrideKey",
        "ramThresholdMBLow",
        "sampleSeconds"
      ]
    },
    "budget": {
      "type": "object",
      "properties": {
        "maxAabBaseSizeMB": {
          "type": "integer"
        },
        "maxApkSizeMB": {
          "type": "integer"
        },
        "maxColdStartToInteractiveMs": {
          "type": "integer"
        },
        "maxDrawCallsHigh": {
          "type": "integer"
        },
        "maxDrawCallsLow": {
          "type": "integer"
        },
        "maxDrawCallsMedium": {
          "type": "integer"
        },
        "maxGcAllocPerFrameBytes": {
          "type": "integer"
        },
        "maxSceneLoadMs": {
          "type": "integer"
        },
        "maxTextureMemoryMB": {
          "type": "integer"
        },
        "maxTrisPerFrame": {
          "type": "integer"
        },
        "targetFpsHigh": {
          "type": "integer"
        },
        "targetFpsLow": {
          "type": "integer"
        },
        "targetFpsMedium": {
          "type": "integer"
        }
      },
      "required": [
        "maxAabBaseSizeMB",
        "maxApkSizeMB",
        "maxColdStartToInteractiveMs",
        "maxDrawCallsHigh",
        "maxDrawCallsLow",
        "maxDrawCallsMedium",
        "maxGcAllocPerFrameBytes",
        "maxSceneLoadMs",
        "maxTextureMemoryMB",
        "maxTrisPerFrame",
        "targetFpsHigh",
        "targetFpsLow",
        "targetFpsMedium"
      ]
    },
    "qualityLevels": {
      "type": "array",
      "items": {
        "type": "object",
        "properties": {
          "dynamicLights": {
            "type": "integer"
          },
          "emberParticles": {
            "type": "boolean"
          },
          "id": {
            "type": "string",
            "pattern": "^[A-Z][A-Z0-9_]*$"
          },
          "lodBias": {
            "type": "number"
          },
          "maxActiveCustomers": {
            "type": "integer"
          },
          "particlesMultiplier": {
            "type": "number"
          },
          "postProcessing": {
            "type": "string"
          },
          "resolutionScale": {
            "type": "number"
          },
          "shadowDistance": {
            "type": "integer"
          },
          "shadows": {
            "type": "string"
          },
          "smokeEnabled": {
            "type": "boolean"
          },
          "vSync": {
            "type": "boolean"
          },
          "vfxGrillMarks": {
            "type": "boolean"
          }
        },
        "required": [
          "dynamicLights",
          "emberParticles",
          "id",
          "lodBias",
          "maxActiveCustomers",
          "particlesMultiplier",
          "postProcessing",
          "resolutionScale",
          "shadowDistance",
          "shadows",
          "smokeEnabled",
          "vSync",
          "vfxGrillMarks"
        ]
      }
    },
    "renderPipeline": {
      "type": "object",
      "properties": {
        "batching": {
          "type": "array",
          "items": {
            "type": "string"
          }
        },
        "choice": {
          "type": "string"
        },
        "reason": {
          "type": "string"
        },
        "shaders": {
          "type": "array",
          "items": {
            "type": "string"
          }
        }
      },
      "required": [
        "batching",
        "choice",
        "reason",
        "shaders"
      ]
    },
    "version": {
      "type": "integer"
    }
  }
}
